<?xml version="1.0" encoding="UTF-8"?>
<!-- Example TandT_CPP_DespatchAdvice_Farmusol_HollandFyto_11feb19 by Conny Graumans (AgroConnect) -->
<ttdesp:MessageHeader xmlns:xsi="http://www.w3.org/2001/XMLSchema-instance" xmlns:ttdesp="http://www.agroconnect.nl/Portals/10/XSDs/TandT_CPP/v2018p01/TandT_CPP_DespatchAdvice_v2018p01" xsi:schemaLocation="http://www.agroconnect.nl/Portals/10/XSDs/TandT_CPP/v2018p01/TandT_CPP_DespatchAdvice_v2018p01 http://www.agroconnect.nl/Portals/10/XSDs/TandT_CPP/v2018p01/TandT_CPP_DespatchAdvice_v2018p01.xsd">
	<ttdesp:MessageID schemeID="REF">MES123456</ttdesp:MessageID>
	<ttdesp:SendingDateTime>2018-07-01T09:30:47Z</ttdesp:SendingDateTime>
	<ttdesp:SendingPartyID schemeID="GLN">8719333007229</ttdesp:SendingPartyID><!--GLN Farmusol-->
	<ttdesp:ReceivingPartyID schemeID="GLN">8719324290005</ttdesp:ReceivingPartyID><!--GLN Holland Fyto-->
	<ttdesp:MessageType>102</ttdesp:MessageType><!-- = Deliver-->
	<ttdesp:MessagePurposeCode>47</ttdesp:MessagePurposeCode><!--47= for production, definitive-->
	<ttdesp:Delivery>
		<ttdesp:DeliveryID schemeID="REF">DEL234567</ttdesp:DeliveryID><!--Generated by Farmusol-->
		<ttdesp:DeliveryStatusCode>101</ttdesp:DeliveryStatusCode><!--101= original-->
		<ttdesp:DeliveryDateTime>2018-10-10T09:30:47Z</ttdesp:DeliveryDateTime>
		<ttdesp:GrossWeight unitCode="KGM">2000</ttdesp:GrossWeight>
		<ttdesp:NetWeight unitCode="KGM">1800</ttdesp:NetWeight>
		<ttdesp:Timing>
			<ttdesp:EventTypeCode>101</ttdesp:EventTypeCode><!-- = Load-->
			<ttdesp:EventDateTime>2018-07-10T09:30:47Z</ttdesp:EventDateTime>
		</ttdesp:Timing>
		<ttdesp:Timing>
			<ttdesp:EventTypeCode>102</ttdesp:EventTypeCode><!-- = Deliver-->
			<ttdesp:EventDateTime>2018-07-10T14:30:47Z</ttdesp:EventDateTime>
		</ttdesp:Timing>
		<ttdesp:Remark>
			<ttdesp:TextFunctionTypeCode>103</ttdesp:TextFunctionTypeCode><!-- = DeliverInstruction-->
			<ttdesp:TextLines>2Loods 13, stelling 5</ttdesp:TextLines>
		</ttdesp:Remark>
		<ttdesp:MeansOfTransportation>
			<ttdesp:TransportMeansID schemeID="NUMMERPLAAT">82-ABC-89</ttdesp:TransportMeansID>
			<ttdesp:TransportMeansTypeCode>36</ttdesp:TransportMeansTypeCode><!-- = Truck, dry bulk-->
		</ttdesp:MeansOfTransportation>
		<ttdesp:InternationalCommercialTerms>
			<ttdesp:ICT_ReferenceID>Ref EU2356</ttdesp:ICT_ReferenceID>
			<ttdesp:ICT_Description>Volgens Europese regelgeving.</ttdesp:ICT_Description>
		</ttdesp:InternationalCommercialTerms>
		<ttdesp:TradeParty>
			<ttdesp:GlobalID schemeID="GLN">8719333007229</ttdesp:GlobalID><!--Farmusol-->
			<ttdesp:TradePartyRoleCode>SF</ttdesp:TradePartyRoleCode><!--= ShippedFrom-->
			<ttdesp:TradePartyName>Farmusol B.V.</ttdesp:TradePartyName>
			<ttdesp:StreetNameAndNumber>Industriestraat 10</ttdesp:StreetNameAndNumber>
			<ttdesp:PostalCodeLocation>6827BD</ttdesp:PostalCodeLocation>
			<ttdesp:CityName>Arnhem</ttdesp:CityName>
			<ttdesp:CountryCode>NL</ttdesp:CountryCode>
			<ttdesp:PersonToContact>Floris Rhemrev</ttdesp:PersonToContact>
		</ttdesp:TradeParty>	
		<ttdesp:TradeParty>
			 <ttdesp:GlobalID schemeID="GLN">8719324290005</ttdesp:GlobalID><!--GLN Holland Fyto-->
			 <ttdesp:TradePartyRoleCode>ST</ttdesp:TradePartyRoleCode><!--= ShippedTo-->
			 <ttdesp:TradePartyName>Holland Fyto</ttdesp:TradePartyName>
			 <ttdesp:PostBoxNumber>Postbus 1077</ttdesp:PostBoxNumber>
			 <ttdesp:PostalCodePostBox>8300 BB</ttdesp:PostalCodePostBox>
			 <ttdesp:CityNamePostBox>EMMELOORD</ttdesp:CityNamePostBox>
			 <ttdesp:CountryCodePostBox>NLD</ttdesp:CountryCodePostBox>
		</ttdesp:TradeParty>
		<ttdesp:DeliveryLine>
			<ttdesp:DeliveryLineID schemeID="REF">Nr123456</ttdesp:DeliveryLineID>
			<ttdesp:DeliveryLineQuantity unitCode="NBR">1</ttdesp:DeliveryLineQuantity><!--in this case 1 pallet-->
			<ttdesp:OrderReferenceID schemeID="REF">Ordernr12345</ttdesp:OrderReferenceID>
			<ttdesp:OrderLineReferenceID schemeID="REF">Orderlinenr12345667</ttdesp:OrderLineReferenceID>
			<ttdesp:ProductUnit>
				<ttdesp:ProductUnitID_SSCC schemeID="SSCC">4896512765432</ttdesp:ProductUnitID_SSCC><!--SSCC of the pallet-->
				<ttdesp:ProductUnitTypeCode>101</ttdesp:ProductUnitTypeCode><!-- = LogisticUnit-->
				<ttdesp:ProductUnitName>Pallet Captosan</ttdesp:ProductUnitName>
				<ttdesp:PackageTypeCode>PA</ttdesp:PackageTypeCode><!-- = Pallet-->
				<ttdesp:ProductionDate>2017-12-17T09:30:47Z</ttdesp:ProductionDate>
			</ttdesp:ProductUnit>
			<ttdesp:PackageProductUnitFirstLevel>
				<ttdesp:Quantity>10</ttdesp:Quantity><!--number of TradeUnits Captosan on the pallet-->
				<ttdesp:ProductUnit>
					<ttdesp:ProductUnitID_GTIN schemeID="GTIN">08718077002453</ttdesp:ProductUnitID_GTIN>
					<ttdesp:ProductUnitTypeCode>102</ttdesp:ProductUnitTypeCode><!-- = TradeUnit-->
					<ttdesp:BatchID>34781289</ttdesp:BatchID>
					<ttdesp:ProductUnitName>Box Captosan 500 SC</ttdesp:ProductUnitName>
					<ttdesp:PackageTypeCode>BX</ttdesp:PackageTypeCode><!-- = Box-->
					<ttdesp:ProductionDate>2017-12-17T09:30:47Z</ttdesp:ProductionDate>
				</ttdesp:ProductUnit>
				<ttdesp:PackageProductUnitSecondLevel>
					<ttdesp:Quantity>8</ttdesp:Quantity><!--number of ConsumerUnits in each TradeUnit-->
					<ttdesp:ProductUnit>
						<ttdesp:ProductUnitID_GTIN schemeID="GTIN">08718077002446</ttdesp:ProductUnitID_GTIN>
						<ttdesp:ProductUnitTypeCode>103</ttdesp:ProductUnitTypeCode><!-- = ConsumerUnit-->
						<ttdesp:BatchID>34781289</ttdesp:BatchID>
						<ttdesp:ProductUnitName>Captosan 500 SC</ttdesp:ProductUnitName>
						<ttdesp:PackageTypeCode>BO</ttdesp:PackageTypeCode><!-- = Bottle-->
						<ttdesp:SerialNumber>PROD345678</ttdesp:SerialNumber>
						<ttdesp:ProductionDate>2017-12-31T09:30:47Z</ttdesp:ProductionDate>
						<ttdesp:ExpiryDate>2020-12-17T09:30:47Z</ttdesp:ExpiryDate>
					</ttdesp:ProductUnit>
				</ttdesp:PackageProductUnitSecondLevel>
			</ttdesp:PackageProductUnitFirstLevel>
			<ttdesp:PackageProductUnitFirstLevel>
				<ttdesp:Quantity>5</ttdesp:Quantity><!--number of TradeUnits ProductX on the pallet-->
				<ttdesp:ProductUnit>
					<ttdesp:ProductUnitID_GTIN schemeID="GTIN">08718077002999</ttdesp:ProductUnitID_GTIN>
					<ttdesp:ProductUnitTypeCode>102</ttdesp:ProductUnitTypeCode><!-- = TradeUnit-->
					<ttdesp:BatchID>34786789</ttdesp:BatchID>
					<ttdesp:ProductUnitName>Box with 6 ProduxtX ConsumerUnits</ttdesp:ProductUnitName>
					<ttdesp:PackageTypeCode>BX</ttdesp:PackageTypeCode><!-- = Box-->
					<ttdesp:ProductionDate>2017-12-17T09:30:47Z</ttdesp:ProductionDate>
					<ttdesp:ExpiryDate>2020-12-17T09:30:47Z</ttdesp:ExpiryDate>
				</ttdesp:ProductUnit>
				<ttdesp:PackageProductUnitSecondLevel>
					<ttdesp:Quantity>4</ttdesp:Quantity><!--number of ConsumerUnits in each TradeUnit-->
					<ttdesp:ProductUnit>
						<ttdesp:ProductUnitID_GTIN schemeID="GTIN">08718077003999</ttdesp:ProductUnitID_GTIN>
						<ttdesp:ProductUnitTypeCode>103</ttdesp:ProductUnitTypeCode><!-- = ConsumerUnit-->
						<ttdesp:BatchID>34781289</ttdesp:BatchID>
						<ttdesp:ProductUnitName>Bottle ProductX</ttdesp:ProductUnitName>
						<ttdesp:PackageTypeCode>BO</ttdesp:PackageTypeCode><!-- = Bottle-->
						<ttdesp:SerialNumber>PROD345678</ttdesp:SerialNumber>
						<ttdesp:ProductionDate>2017-12-31T09:30:47Z</ttdesp:ProductionDate>
						<ttdesp:ExpiryDate>2020-12-17T09:30:47Z</ttdesp:ExpiryDate>
					</ttdesp:ProductUnit>
				</ttdesp:PackageProductUnitSecondLevel>
			</ttdesp:PackageProductUnitFirstLevel>
		</ttdesp:DeliveryLine>
	</ttdesp:Delivery>
</ttdesp:MessageHeader>
