<?xml version="1.0" encoding="UTF-8"?>
<!-- Example DespatchAdvice homogenious pallet from Farmusol to Holland Fyto-->
<ttdesp:MessageHeader xmlns:xsi="http://www.w3.org/2001/XMLSchema-instance" xmlns:ttdesp="http://www.agroconnect.nl/Portals/10/XSDs/TandT_CPP/v2018p01/TandT_CPP_DespatchAdvice_v2018p01" xsi:schemaLocation="http://www.agroconnect.nl/Portals/10/XSDs/TandT_CPP/v2018p01/TandT_CPP_DespatchAdvice_v2018p01 http://www.agroconnect.nl/Portals/10/XSDs/TandT_CPP/v2018p01/TandT_CPP_DespatchAdvice_v2018p01.xsd">
	<ttdesp:MessageID schemeID="REF">DA_0000330601</ttdesp:MessageID>
	<ttdesp:SendingDateTime>2019-03-04T09:30:47Z</ttdesp:SendingDateTime>
	<ttdesp:SendingPartyID schemeID="GLN">8719333007229</ttdesp:SendingPartyID><!--GLN Farmusol-->
	<ttdesp:ReceivingPartyID schemeID="GLN">8719324290005</ttdesp:ReceivingPartyID><!--GLN Holland Fyto-->
	<ttdesp:MessageType>102</ttdesp:MessageType><!-- = Deliver-->
	<ttdesp:MessagePurposeCode>47</ttdesp:MessagePurposeCode><!--47= for production, definitive-->
	<ttdesp:Delivery>
		<ttdesp:DeliveryID schemeID="REF">DA_0000330601</ttdesp:DeliveryID><!--Generated by Farmusol-->
		<ttdesp:DeliveryStatusCode>101</ttdesp:DeliveryStatusCode><!--101= original-->
		<ttdesp:DeliveryDateTime>2019-03-15T12:00:00Z</ttdesp:DeliveryDateTime>
		<ttdesp:Timing>
			<ttdesp:EventTypeCode>101</ttdesp:EventTypeCode><!-- = Load-->
			<ttdesp:EventDateTime>2019-03-15T09:30:00Z</ttdesp:EventDateTime>
		</ttdesp:Timing>
		<ttdesp:Timing>
			<ttdesp:EventTypeCode>102</ttdesp:EventTypeCode><!-- = Deliver-->
			<ttdesp:EventDateTime>2019-03-15T11:30:00Z</ttdesp:EventDateTime>
		</ttdesp:Timing>
		<ttdesp:Remark>
			<ttdesp:TextFunctionTypeCode>103</ttdesp:TextFunctionTypeCode><!-- = DeliverInstruction-->
			<ttdesp:TextLines>2Loods 13, stelling 5</ttdesp:TextLines>
		</ttdesp:Remark>
		<ttdesp:MeansOfTransportation>
			<ttdesp:TransportMeansID schemeID="NUMMERPLAAT">82-ABC-89</ttdesp:TransportMeansID>
			<ttdesp:TransportMeansTypeCode>36</ttdesp:TransportMeansTypeCode><!-- = Truck, dry bulk-->
		</ttdesp:MeansOfTransportation>
		<ttdesp:InternationalCommercialTerms>
			<ttdesp:ICT_ReferenceID>Ref EU2356</ttdesp:ICT_ReferenceID>
			<ttdesp:ICT_Description>Volgens Europese regelgeving.</ttdesp:ICT_Description>
		</ttdesp:InternationalCommercialTerms>
		<ttdesp:TradeParty>
			<ttdesp:GlobalID schemeID="GLN">8719333007229</ttdesp:GlobalID><!--Farmusol-->
			<ttdesp:TradePartyRoleCode>SF</ttdesp:TradePartyRoleCode><!--= ShippedFrom-->
			<ttdesp:TradePartyName>Farmusol B.V.</ttdesp:TradePartyName>
			<ttdesp:StreetNameAndNumber>Industriestraat 10</ttdesp:StreetNameAndNumber>
			<ttdesp:PostalCodeLocation>6827BD</ttdesp:PostalCodeLocation>
			<ttdesp:CityName>Arnhem</ttdesp:CityName>
			<ttdesp:CountryCode>NL</ttdesp:CountryCode>
			<ttdesp:PersonToContact>Floris Rhemrev</ttdesp:PersonToContact>
		</ttdesp:TradeParty>	
		<ttdesp:TradeParty>
			 <ttdesp:GlobalID schemeID="GLN">8719324290005</ttdesp:GlobalID><!--GLN Holland Fyto-->
			 <ttdesp:TradePartyRoleCode>ST</ttdesp:TradePartyRoleCode><!--= ShippedTo-->
			 <ttdesp:TradePartyName>Holland Fyto</ttdesp:TradePartyName>
			 <ttdesp:PostBoxNumber>Postbus 1077</ttdesp:PostBoxNumber>
			 <ttdesp:PostalCodePostBox>8300 BB</ttdesp:PostalCodePostBox>
			 <ttdesp:CityNamePostBox>EMMELOORD</ttdesp:CityNamePostBox>
			 <ttdesp:CountryCodePostBox>NLD</ttdesp:CountryCodePostBox>
		</ttdesp:TradeParty>
      <ttdesp:DeliveryLine>
         <ttdesp:DeliveryLineID schemeID="REF">TO0000330401-0001</ttdesp:DeliveryLineID>
         <ttdesp:DeliveryLineQuantity unitCode="NBR">1</ttdesp:DeliveryLineQuantity><!--1 pallet-->
         <ttdesp:ProductUnit>
			<ttdesp:ProductUnitID_SSCC schemeID="SSCC">4896512765432</ttdesp:ProductUnitID_SSCC><!--SSCC of the pallet-->
			<ttdesp:ProductUnitTypeCode>101</ttdesp:ProductUnitTypeCode><!--= LogisticUnit-->
            <ttdesp:ProductUnitName>Uniforme pallet pallet Goltix SC (600 liter/30 trade units/120 consumer units)</ttdesp:ProductUnitName>
			<ttdesp:PackageTypeCode>PA</ttdesp:PackageTypeCode><!--= pallet-->
         </ttdesp:ProductUnit>
		<ttdesp:PackageProductUnitFirstLevel>
			<ttdesp:Quantity>30</ttdesp:Quantity><!--number of TradeUnits on the pallet-->
			<ttdesp:ProductUnit>
				<ttdesp:ProductUnitID_GTIN schemeID="GTIN">08718077002156</ttdesp:ProductUnitID_GTIN>
				<ttdesp:ProductUnitTypeCode>102</ttdesp:ProductUnitTypeCode><!-- = TradeUnit-->
				<ttdesp:BatchID>1901030567</ttdesp:BatchID>
				<ttdesp:ProductUnitName>Goltix SC</ttdesp:ProductUnitName>
				<ttdesp:PackageTypeCode>JY</ttdesp:PackageTypeCode><!--= Jerrican, cylindrical-->
				<ttdesp:ProductionDate>2019-01-10T09:30:47Z</ttdesp:ProductionDate>
			</ttdesp:ProductUnit>
		</ttdesp:PackageProductUnitFirstLevel>            
      </ttdesp:DeliveryLine>
      <ttdesp:DeliveryLine>
         <ttdesp:DeliveryLineID schemeID="REF">TO0000330401-0002</ttdesp:DeliveryLineID>
         <ttdesp:DeliveryLineQuantity unitCode="NBR">1</ttdesp:DeliveryLineQuantity><!--1 pallet-->
         <ttdesp:ProductUnit>
			<ttdesp:ProductUnitID_SSCC schemeID="SSCC">4896512765589</ttdesp:ProductUnitID_SSCC><!--SSCC of the pallet-->
            <ttdesp:ProductUnitTypeCode>101</ttdesp:ProductUnitTypeCode><!--= LogisticUnit-->
            <ttdesp:ProductUnitName>Uniforme pallet Mirador Xtra (600 liter/30 trade units/120 consumer units)</ttdesp:ProductUnitName>
			<ttdesp:PackageTypeCode>PA</ttdesp:PackageTypeCode><!--= pallet-->
         </ttdesp:ProductUnit>
		<ttdesp:PackageProductUnitFirstLevel>
			<ttdesp:Quantity>30</ttdesp:Quantity><!--number of TradeUnits on the pallet-->
			<ttdesp:ProductUnit>
				<ttdesp:ProductUnitID_GTIN schemeID="GTIN">08718077012896</ttdesp:ProductUnitID_GTIN>
				<ttdesp:ProductUnitTypeCode>102</ttdesp:ProductUnitTypeCode><!-- = TradeUnit-->
				<ttdesp:BatchID>1901010032</ttdesp:BatchID>
				<ttdesp:ProductUnitName>Mirador Xtra</ttdesp:ProductUnitName>
				<ttdesp:PackageTypeCode>JY</ttdesp:PackageTypeCode><!--= Jerrican, cylindrical-->
				<ttdesp:ProductionDate>2019-01-24T09:30:47Z</ttdesp:ProductionDate>
			</ttdesp:ProductUnit>
		</ttdesp:PackageProductUnitFirstLevel> 
      </ttdesp:DeliveryLine>
	</ttdesp:Delivery>
</ttdesp:MessageHeader>
